title,doi,pii,journal,year,canonical_url,article_key,article_dir,run_ids,status
Additive manufacturing of transparent conductive indium tin oxide by sol-gel and multiphoton absorption polymerization,10.1016/j.addma.2024.104388,S2214860424004342,Additive Manufacturing,2024,https://www.sciencedirect.com/science/article/pii/S2214860424004342,10.1016-j.addma.2024.104388,articles/sciencedirect/_library/10.1016-j.addma.2024.104388,20260426-161916-436839-sciencedirect-search-4de3a8;20260426-162346-854413-sciencedirect-crawl-e521da;20260426-162504-366172-sciencedirect-crawl-520e44,skipped
"Flexible, transparent, and low-temperature usable electromagnetic shielding film based on orthogonally arranged silver nanowire network/graphene oxide conductive network",10.1016/j.cplett.2024.141701,S0009261424006432,Chemical Physics Letters,2024,https://www.sciencedirect.com/science/article/pii/S0009261424006432,10.1016-j.cplett.2024.141701,articles/sciencedirect/_library/10.1016-j.cplett.2024.141701,20260426-161916-436839-sciencedirect-search-4de3a8;20260426-162346-854413-sciencedirect-crawl-e521da;20260426-162504-366172-sciencedirect-crawl-520e44,done
Sb-doped tin oxide nanonets for improved conductivity in transparent conductive coatings,10.1016/j.matchemphys.2024.129476,S0254058424006011,Materials Chemistry and Physics,2024,https://www.sciencedirect.com/science/article/pii/S0254058424006011,10.1016-j.matchemphys.2024.129476,articles/sciencedirect/_library/10.1016-j.matchemphys.2024.129476,20260426-161916-436839-sciencedirect-search-4de3a8;20260426-162346-854413-sciencedirect-crawl-e521da;20260426-162504-366172-sciencedirect-crawl-520e44,done
Investigation on optical and electrical properties of multilayer ITO/AZO/ITO transparent conductive oxides,10.1016/j.optmat.2024.115850,S0925346724010334,Optical Materials,2024,https://www.sciencedirect.com/science/article/pii/S0925346724010334,10.1016-j.optmat.2024.115850,articles/sciencedirect/_library/10.1016-j.optmat.2024.115850,20260426-161916-436839-sciencedirect-search-4de3a8;20260426-162346-854413-sciencedirect-crawl-e521da;20260426-162504-366172-sciencedirect-crawl-520e44,done
Scalable one-step synthesis of reduced graphene oxide: Towards flexible transparent conductive films and active supercapacitor electrodes,10.1016/j.cej.2024.150828,S1385894724023155,Chemical Engineering Journal,2024,https://www.sciencedirect.com/science/article/pii/S1385894724023155,10.1016-j.cej.2024.150828,articles/sciencedirect/_library/10.1016-j.cej.2024.150828,20260426-161916-436839-sciencedirect-search-4de3a8;20260426-162346-854413-sciencedirect-crawl-e521da;20260426-162504-366172-sciencedirect-crawl-520e44,done
